source_ref	fixture_path	metadata_key	metadata_value	marker_key	marker_value	notes
prusaslicer:version_2.9.5@9a583bd438b195856f3bcf7ea99b69ba4003a961	packages/parity-fixtures/forks/prusaslicer/prusaslicer.gcode-output/gcodewriter-set-speed.gcode	source_identity	prusaslicer:version_2.9.5@9a583bd438b195856f3bcf7ea99b69ba4003a961	source_literal	tests/fff_print/test_gcodewriter.cpp#L20-L35	Accepted PrusaSlicer source identity and upstream test literal trace only; no generated-output behavior claimed.
prusaslicer:version_2.9.5@9a583bd438b195856f3bcf7ea99b69ba4003a961	packages/parity-fixtures/forks/prusaslicer/prusaslicer.gcode-output/gcodewriter-set-speed.gcode	fixture_role	source-controlled-gcodewriter-set-speed-expected-output	line_1	G1 F99999.123	Representative fixed-point feedrate command marker; no motion, extrusion, timing, or printability semantics claimed.
prusaslicer:version_2.9.5@9a583bd438b195856f3bcf7ea99b69ba4003a961	packages/parity-fixtures/forks/prusaslicer/prusaslicer.gcode-output/gcodewriter-set-speed.gcode	fixture_role	source-controlled-gcodewriter-set-speed-expected-output	line_2	G1 F1	Representative integer feedrate command marker; no motion, extrusion, timing, or printability semantics claimed.
prusaslicer:version_2.9.5@9a583bd438b195856f3bcf7ea99b69ba4003a961	packages/parity-fixtures/forks/prusaslicer/prusaslicer.gcode-output/gcodewriter-set-speed.gcode	fixture_role	source-controlled-gcodewriter-set-speed-expected-output	line_3	G1 F203.2	Representative one-decimal feedrate command marker; no motion, extrusion, timing, or printability semantics claimed.
prusaslicer:version_2.9.5@9a583bd438b195856f3bcf7ea99b69ba4003a961	packages/parity-fixtures/forks/prusaslicer/prusaslicer.gcode-output/gcodewriter-set-speed.gcode	fixture_role	source-controlled-gcodewriter-set-speed-expected-output	line_4	G1 F203.201	Representative three-decimal rounded feedrate command marker; no motion, extrusion, timing, or printability semantics claimed.
